user,text,location,date,topic
DiscoverMag,The universe's biggest blasts take on a new dimension. https://t.co/wew0rgKJ2M,Between gluons and galaxies,2020-01-23 00:30:25,Science
DiscoverMag,Understanding what cuteness is and how it affects us may help us harness its powers for good. https://t.co/AFhBlEb04N,Between gluons and galaxies,2020-01-23 00:00:41,Science
DiscoverMag,Helmet usage would keep more e-scooter riders out of the emergency room. https://t.co/6va4uCN81E,Between gluons and galaxies,2020-01-22 23:30:09,Science
DiscoverMag,“East Antarctica is the sleeping giant.” https://t.co/lCknMFdQxs,Between gluons and galaxies,2020-01-22 23:00:29,Science
DiscoverMag,Melting permafrost in the Arctic is unearthing diseases and destroying landscapes. https://t.co/yrzrv5AbJw,Between gluons and galaxies,2020-01-22 22:30:12,Science
DiscoverMag,"Get to know why Siri, Alexa and their digital rivals are who they are. https://t.co/eZYPj1ohhh",Between gluons and galaxies,2020-01-22 22:00:29,Science
DiscoverMag,"Copernicus' ideas forced humanity to consider our planet a ball of rock circling the fiery Sun, and not at the center of the universe. https://t.co/KP05EBQQwE",Between gluons and galaxies,2020-01-22 21:30:10,Science
DiscoverMag,5 things that will help keep your microbiome healthy https://t.co/Xr62kb5Vmd,Between gluons and galaxies,2020-01-22 21:00:29,Science
DiscoverMag,Do our health choices early on in life matter? And is it possible to catch up if we’ve fallen behind? https://t.co/ulVElIouKT,Between gluons and galaxies,2020-01-22 20:30:10,Science
DiscoverMag,"There's some evidence of set points, but they don't determine your fate. https://t.co/TJQ1Dvgeqv",Between gluons and galaxies,2020-01-22 20:00:36,Science
DiscoverMag,It’s possible to choose between being the captain or the co-pilot of your dreams. https://t.co/ZFIAu7lp2e,Between gluons and galaxies,2020-01-22 19:30:27,Science
DiscoverMag,Where does the iron in the Sun come from? https://t.co/7a6nbGCASh,Between gluons and galaxies,2020-01-22 19:00:33,Science
DiscoverMag,Tests could reveal whether we are part of a giant computer simulation — but the real question is if we want to know... https://t.co/iYujJkgQTj,Between gluons and galaxies,2020-01-22 18:30:11,Science
DiscoverMag,Drugs can cause permanent harm to the brain. We're only beginning to find ways to heal the hurt. https://t.co/OuVbbemE7h,Between gluons and galaxies,2020-01-22 18:00:31,Science
DiscoverMag,"Antarctica is a desolate, far-away place, but what happens there could reshape life along the coasts. https://t.co/g2n0wRPhGK",Between gluons and galaxies,2020-01-22 17:30:09,Science
DiscoverMag,"These women lack olfactory bulbs, but somehow still have a sense of smell. https://t.co/rcjIu8rRRm",Between gluons and galaxies,2020-01-22 17:00:37,Science
DiscoverMag,"Astronomers have learned a lot about Saturn's rings since Galileo discovered the ringed planet, but there's still many mysteries to be solved. https://t.co/K9DaIhmJAZ",Between gluons and galaxies,2020-01-22 16:30:12,Science
DiscoverMag,"Hao Huang unequivocally proved the sensitivity conjecture, a thorn in the side of computer scientists for decades. https://t.co/iTD2frsJCW",Between gluons and galaxies,2020-01-22 16:00:40,Science
DiscoverMag,The best way to start on your journey toward wine wisdom is to try what’s called the “triangle test.” It’s used frequently in wine research. https://t.co/05XNjNpLK4,Between gluons and galaxies,2020-01-22 15:30:11,Science
DiscoverMag,Scientists gain a new glimpse into a billions-of-years-old event in the universe that allowed light to shine freely. https://t.co/RPoGONi6g6,Between gluons and galaxies,2020-01-22 15:00:34,Science
DiscoverMag,"From the year 2000: Technology never just hands us tools; it grants us a passport to a world where choices multiply, desires are ignited, and new moral decisions confront us. https://t.co/XVtwKT1E3T",Between gluons and galaxies,2020-01-22 14:30:09,Science
DiscoverMag,What happened the last time Antarctica melted? https://t.co/EZZxRzo3c6,Between gluons and galaxies,2020-01-22 14:00:43,Science
DiscoverMag,"K dwarfs are relatively safe and long-lived, making them potentially ideal stellar neighborhoods for life. https://t.co/9XlE7eCZgX",Between gluons and galaxies,2020-01-22 13:30:08,Science
DiscoverMag,There are windows of opportunity for learning while we sleep. https://t.co/zHGQpJfRlO,Between gluons and galaxies,2020-01-22 13:00:29,Science
DiscoverMag,Do black holes live forever? https://t.co/GonNBHwOAd,Between gluons and galaxies,2020-01-22 12:30:23,Science
DiscoverMag,Say hello to the 500 species of bugs and insects you share your house with: https://t.co/qE2msYR4Jy,Between gluons and galaxies,2020-01-22 12:00:39,Science
DiscoverMag,"Not only are extreme altruists’ brains different from a normal person’s, they’re basically the opposite of a psychopath’s in one key way https://t.co/8jpnyNPDav",Between gluons and galaxies,2020-01-22 11:30:10,Science
DiscoverMag,"How DNA evidence shed light on the history and origin of the Atacama ""alien"": https://t.co/9z1L58qSVh",Between gluons and galaxies,2020-01-22 11:00:41,Science
DiscoverMag,A molecular evolutionary biologist says Darwin never proved natural selection is the driving force of evolution — because it isn't. https://t.co/kcu4BCIoHC,Between gluons and galaxies,2020-01-22 10:30:20,Science
DiscoverMag,"You can freeze them, burn them, dry them out or even blast them into space, but humble tardigrades can survive it all. https://t.co/4az6azAIE8",Between gluons and galaxies,2020-01-22 10:00:21,Science
DiscoverMag,These experiments changed our understanding of the universe and ourselves. https://t.co/F3JZXLlVX4,Between gluons and galaxies,2020-01-22 09:30:24,Science
DiscoverMag,Voyager 2: These latest results carry a number of surprises for astronomers. https://t.co/1XCO6LoaaU,Between gluons and galaxies,2020-01-22 09:00:27,Science
DiscoverMag,Why can't we turn salt water into drinking water? https://t.co/7VCEkaFS3m,Between gluons and galaxies,2020-01-22 08:30:07,Science
DiscoverMag,Why does time feel like it's zipping by faster the older we get? https://t.co/0uVd22j5kq,Between gluons and galaxies,2020-01-22 08:00:15,Science
DiscoverMag,"Einstein's general relativity may be complicated, but it's our best way of understanding the universe. https://t.co/MV4IyPNFIW",Between gluons and galaxies,2020-01-22 07:30:08,Science
DiscoverMag,There’s something odd about the bones of ancient humans. They’re riddled with deformities. https://t.co/6eRavJHzhl,Between gluons and galaxies,2020-01-22 07:00:15,Science
DiscoverMag,"If accelerated inflationary expansion occurred in the early universe, inflation itself is what puts the “bang” into the Big Bang. https://t.co/L5ZWzCtOYi",Between gluons and galaxies,2020-01-22 06:30:08,Science
DiscoverMag,Humans get heart attacks at far higher rates than other species. Lifestyle can't account for all of the difference — so what else is breaking our hearts? https://t.co/bHMGUObu3Z,Between gluons and galaxies,2020-01-22 06:00:14,Science
DiscoverMag,"What would you say if you saw this stranger on a bus? Well, if you’re Christian, you might say he’s God. https://t.co/eqdMZg1r3w",Between gluons and galaxies,2020-01-22 05:30:16,Science
DiscoverMag,"In the next 30 years, Earth’s population will increase so much that it will exhaust the planet’s ability to grow enough food. https://t.co/rzileZXhm9",Between gluons and galaxies,2020-01-22 05:00:15,Science
DiscoverMag,"From the vault: Although Neanderthals and Homo erectus are widely known, Boskops are almost entirely forgotten. https://t.co/AJNzBHzI88",Between gluons and galaxies,2020-01-22 04:30:05,Science
DiscoverMag,"Thanks to this artist, we knew what space looked like before there was spacecraft to show us: https://t.co/FQQWxn9IWa",Between gluons and galaxies,2020-01-22 04:00:14,Science
DiscoverMag,"For centuries, physicists have hunted for magnetic monopoles to help put together their theory of everything. They may be closer than ever. https://t.co/oy1ng4Z3RK",Between gluons and galaxies,2020-01-22 03:30:07,Science
DiscoverMag,We can catch diseases from our pets simply because of how much time we spend together. https://t.co/HBfr3Oua5K,Between gluons and galaxies,2020-01-22 03:00:21,Science
DiscoverMag,Researchers work to fine-tune a test that could better detect lingering disease in cancer patients. https://t.co/1q256QAOzn,Between gluons and galaxies,2020-01-22 02:30:08,Science
DiscoverMag,"Most galaxies have a black hole at the center, and astronomers have found the mass is consistently about 1/1000th the mass of the host galaxy. https://t.co/g0kSgcOY5u",Between gluons and galaxies,2020-01-22 02:00:23,Science
DiscoverMag,"In 1207 BCE, during a battle between the Israelites and warriors of Canaan, the ""sun stood still and the moon stopped"" https://t.co/jL75QaHL8r",Between gluons and galaxies,2020-01-22 01:30:07,Science
DiscoverMag,"When a civilization-ending space rock bears down on us, this nuclear option might just save our species. https://t.co/MfTMh4xhDJ",Between gluons and galaxies,2020-01-22 01:00:30,Science
DiscoverMag,Did Neanderthals have language? Anthropologists have not been able to prove it. https://t.co/oWwFAIPDe0,Between gluons and galaxies,2020-01-22 00:30:26,Science
DiscoverMag,Barriers to using renewable electricity are more political and cultural than technological or economic. https://t.co/rxo80XqM7M,Between gluons and galaxies,2020-01-22 00:00:27,Science
DiscoverMag,"More bodybuilders, professional cyclists and other athletes are turning up their nose at food. A recent study offers evidence that fasting and exercise work well together: https://t.co/qRElUSPg1X",Between gluons and galaxies,2020-01-21 23:30:07,Science
DiscoverMag,20 Things You Didn't Know About ... Testosterone: https://t.co/FrIvHDXlru,Between gluons and galaxies,2020-01-21 23:00:34,Science
DiscoverMag,"The Milky Way is the galaxy we live in, one of the countless collections of stars and dust throughout the universe. It's a reality so basic, grade school kids learn it. But it wasn’t always so obvious. https://t.co/U66jpOTLm1",Between gluons and galaxies,2020-01-21 22:30:10,Science
DiscoverMag,"1.2 to 4.4 million years ago was a happening time in human evolution. It’s when our evolutionary branch — the hominins — diversified into about a dozen species, collectively known as Australopiths. https://t.co/bi7xP1h0sw",Between gluons and galaxies,2020-01-21 22:00:28,Science
DiscoverMag,Neanderthals are depicted as degenerate and slouching because the first skeleton found happened to be arthritic. https://t.co/rMkv4IyPG7,Between gluons and galaxies,2020-01-21 21:30:12,Science
DiscoverMag,Scientists say recent ocean heatwaves pushed marine life north as far as 250 miles. https://t.co/95x5UBJ7Xs,Between gluons and galaxies,2020-01-21 21:00:30,Science
DiscoverMag,"Throughout your lifetime, this 3-pound organ will change more than any other body part. https://t.co/8NsQPplGzE",Between gluons and galaxies,2020-01-21 20:56:40,Science
DiscoverMag,A patient with a history of mental illness claims his hands are possessed. Could his delusional behavior indicate a serious medical condition? https://t.co/2QFb3rYxxk,Between gluons and galaxies,2020-01-21 20:30:29,Science
DiscoverMag,"Is the Red Planet really the best target for a human colony, or should we look somewhere else? https://t.co/U40ENoTbDM",Between gluons and galaxies,2020-01-21 20:00:36,Science
DiscoverMag,"Religion may be an accidental by-product of features of the human brain, evolved for other reasons. https://t.co/OqZGQKqtkJ",Between gluons and galaxies,2020-01-21 19:30:28,Science
DiscoverMag,From the vault: Einstein’s left a few loose threads that cosmologists have struggled to tie up ever since. https://t.co/7pPYOwzaQm,Between gluons and galaxies,2020-01-21 19:00:32,Science
DiscoverMag,"Raphael Mechoulam discovered THC over 50 years ago. Decades later, he's still convinced cannabis could help millions. https://t.co/BqHXwhLC3P",Between gluons and galaxies,2020-01-21 18:30:11,Science
DiscoverMag,"Many people throw things in the recycling bin that they aren’t sure are recyclable, but think should be. The practice is fittingly called “wish-cycling.” https://t.co/CelGpyyn4N",Between gluons and galaxies,2020-01-21 18:00:39,Science
DiscoverMag,"Could this sophisticated, rule-breaking giant virus be a sign of the mythical fourth domain of life? https://t.co/erRCZr2jSf",Between gluons and galaxies,2020-01-21 17:30:25,Science
DiscoverMag,The sound of Krakatoa erupting ruptured eardrums 40 miles away; it circled the world four times. https://t.co/AxX7JiewwS,Between gluons and galaxies,2020-01-21 17:00:38,Science
DiscoverMag,Can the magnetic fields that surround us affect our bodies and brains? https://t.co/fXouaqUxuz,Between gluons and galaxies,2020-01-21 16:30:26,Science
DiscoverMag,The Aral Sea is re-emerging from the desert. Checking in on the once-massive water body's revival. https://t.co/clxK1mv57F,Between gluons and galaxies,2020-01-21 16:00:36,Science
DiscoverMag,"The Dallol pools are likely so hot, salty and acidic that even extremophile microbes are unable to enter. https://t.co/uuXii5TsVd",Between gluons and galaxies,2020-01-21 15:30:27,Science
DiscoverMag,Many scientists believe that anything sent into a black hole would probably be destroyed. But one study suggests that this might not be the case after all. https://t.co/oS6xvH8i6r,Between gluons and galaxies,2020-01-21 15:00:33,Science
DiscoverMag,"From the vault: Scientists solved the mystery of how a 1,600-year-old glass chalice turns blood red in certain lighting. https://t.co/Mg58DNxupU",Between gluons and galaxies,2020-01-21 14:30:25,Science
DiscoverMag,"To purify your air with house plants, you'd need anywhere from 10 to 100 plants per square meter — enough to turn your apartment into a jungle. https://t.co/o4pxcPXySr",Between gluons and galaxies,2020-01-21 14:00:35,Science
DiscoverMag,What you can catch from your cat: https://t.co/iYQje6wWwW,Between gluons and galaxies,2020-01-21 13:30:09,Science
DiscoverMag,A new study argues that our bodies have cooled off appreciably since the 1800s. https://t.co/6YFFPHf7BQ,Between gluons and galaxies,2020-01-21 13:00:27,Science
DiscoverMag,"A Mormon missionary suddenly can’t move his legs. What can his 
doctors do to help him walk again? https://t.co/hwMWoeZBio",Between gluons and galaxies,2020-01-21 12:30:25,Science
DiscoverMag,"As more e-scooters cruise through city streets, a growing number of their riders are ending their trip in the hospital. https://t.co/6va4uCN81E",Between gluons and galaxies,2020-01-21 12:00:33,Science
DiscoverMag,New advances in stem cell technology are paving the way for same-sex couples to have a baby that’s entirely their own. https://t.co/IraCFA7bds,Between gluons and galaxies,2020-01-21 11:30:08,Science
DiscoverMag,From the vault: Resolution of these profound questions could unlock the secrets of existence and deliver a new age of science within several decades. https://t.co/93lZO4NJ7V,Between gluons and galaxies,2020-01-21 11:00:34,Science
DiscoverMag,"Why do women continously have breasts (unlike other primates, who only develop them when they're ovulating or breastfeeding)? https://t.co/uLiAABzB7V",Between gluons and galaxies,2020-01-21 10:30:09,Science
DiscoverMag,"Sweet like sugar, but without the calories — a promise that might be too good to be true. https://t.co/fW3ouU1Xp2",Between gluons and galaxies,2020-01-21 10:00:18,Science
DiscoverMag,"Elizabeth Katkin tried for years to conceive a child. With the help of futuristic fertility tech, she finally succeeded. https://t.co/9NPd5QWtp7",Between gluons and galaxies,2020-01-21 09:30:19,Science
DiscoverMag,"Indonesian site suggests archaic humans perished about 110,000 years ago https://t.co/5FXvogoLT6",Between gluons and galaxies,2020-01-21 09:00:25,Science
DiscoverMag,Wolf pups retrieved balls for humans in a new study — but questions remain as to why this behavior exists. https://t.co/KeXljnuX9j,Between gluons and galaxies,2020-01-21 08:30:07,Science
DiscoverMag,FODMAPs are a diverse group of hard-to-digest carbs. Here's how to find out which ones upset your stomach. https://t.co/d5MiyXKEtJ,Between gluons and galaxies,2020-01-21 08:00:15,Science
DiscoverMag,"People who swear like a sailor are more honest and more intelligent, studies show. https://t.co/KLCIaSxzdx",Between gluons and galaxies,2020-01-21 07:30:10,Science
DiscoverMag,Photographic do-overs are showing scientists the ways our world is changing. https://t.co/2lXKHifNPV,Between gluons and galaxies,2020-01-21 05:00:13,Science
DiscoverMag,"Why we latch on to superstitious behaviors, and how to give them up. https://t.co/ME9tbItsNA",Between gluons and galaxies,2020-01-21 03:30:13,Science
DiscoverMag,Preliminary research indicates that binaural beats might affect our brains. But don't believe everything a YouTube video says. https://t.co/fOEB7duslm,Between gluons and galaxies,2020-01-21 03:00:20,Science
DiscoverMag,"Is de-extinction playing god, or just plain wrong? https://t.co/LbaOnBtM4l",Between gluons and galaxies,2020-01-21 02:30:18,Science
